{
  "command": "status",
  "correlation_id": "<event-id>",
  "data": {
    "application": "linguawiki",
    "application_version": "<application-version>",
    "contract_schema_version": 1,
    "database_schema_version": 31,
    "persistence": "available",
    "stage": 5
  },
  "generated_at": "<utc-timestamp>",
  "ok": true,
  "schema_version": 1,
  "warnings": []
}
